{
  "document_id": "NDA-003",
  "analysis_path": "ai",
  "model": "configured-model-id",
  "prompt_version": "contract-review.v1",
  "schema_version": "findings.v1",
  "playbook_version": null,
  "template_version": "1.3",
  "generated_at": "2026-08-26T12:00:00Z",
  "wall_time_ms": 2841,
  "usage": {
    "prompt_tokens": 1234,
    "completion_tokens": 456,
    "total_tokens": 1690
  },
  "cost_usd": null
}
